crop_path	page_id	page_num	line_num	label	transcription	image_path	x0	y0	x1	y1
output/crops/page041_line006.png	262534048	41	6	Sanskrit Text	त्स॒ र्व्वे तू प रा॒ भ वं ति।८। स॒ र्व्वे श्या माः॒ । द्वे वै॒ श्या	/Users/suyash/Desktop/project/experimental_results/binarized/MORPHBG_default/00000020.png	258	743	1811	877
output/crops/page041_line007.png	262534048	41	7	Sanskrit Text	म॒ स्य रू पे॒ शु क्लं॒ चै व लो॒ म कृ ष्णं॒ च द्वं द्वं वै॒ मि थु नं॒ प्र	/Users/suyash/Desktop/project/experimental_results/binarized/MORPHBG_default/00000020.png	192	1242	1869	1378
output/crops/page041_line008.png	262534048	41	8	Sanskrit Text	ज॒ न नं प्र ज॒ न नं प्र जा॒ प तिः प्रा जा प त्या॒ ए ते त॒ स्मा त्स॒ र्व्वे श्या	/Users/suyash/Desktop/project/experimental_results/binarized/MORPHBG_default/00000020.png	181	1370	1907	1501
output/crops/page041_line009.png	262534048	41	9	Sanskrit Text	मा॒ भ वं ति।९। स॒ र्व्वे मु ष्क राः॒ प्र ज॒ न नं वै मु ष्क रः॒ प्र	/Users/suyash/Desktop/project/experimental_results/binarized/MORPHBG_default/00000020.png	178	1486	1874	1608
output/crops/page041_line010.png	262534048	41	10	Sanskrit Text	ज॒ न नं प्र जा॒ प तिः प्रा जा प त्या॒ ऽ ए ते त॒ स्मा त्स॒ र्व्वे मु ष्क	/Users/suyash/Desktop/project/experimental_results/binarized/MORPHBG_default/00000020.png	193	1621	1903	1765
output/crops/page041_line011.png	262534048	41	11	Sanskrit Text	रा॒ भ वं ति दु र्व्वे॒ दा ऽ ए व॒ ᳰ स मृ द्धाः प श॒ वो य॒ द्ये व॒ ᳰ	/Users/suyash/Desktop/project/experimental_results/binarized/MORPHBG_default/00000020.png	187	1745	1828	1898
output/crops/page041_line012.png	262534048	41	12	Sanskrit Text	स मृ द्धां न॒ विं दे द॒ पि क ति प या॒ ऽ ए॒ वै व॒ ᳰ स मृ द्धाः	/Users/suyash/Desktop/project/experimental_results/binarized/MORPHBG_default/00000020.png	208	1886	1825	2041
output/crops/page042_line001.png	262534049	42	1	Sanskrit Text	व दा॒ ना नि त द्य॒ द र्द्धा॒ नां द्वि॒ र्द्वि र व द्य॒ ति त॒ थै षा॒ कृ त्स्ना॒	/Users/suyash/Desktop/project/experimental_results/binarized/MORPHBG_default/00000019.png	262	129	1854	287
output/crops/page042_line002.png	262534049	42	2	Sanskrit Text	म्भ व त्य॒ थ य॒ दे तैः᳘ प्र च॒ र ति ते॒ न दै᳘ वीं व्वि॒ श मु॒ ज्ज	/Users/suyash/Desktop/project/experimental_results/binarized/MORPHBG_default/00000019.png	281	281	1878	404
output/crops/page042_line003.png	262534049	42	3	Sanskrit Text	य त्य॒ था र्द्धा᳘ नि मा नु ष्यै᳘ वि श ऽ उ॒ प ह र ति ते॒ नो	/Users/suyash/Desktop/project/experimental_results/binarized/MORPHBG_default/00000019.png	265	393	1866	539
output/crops/page042_line004.png	262534049	42	4	Sanskrit Text	मा नु षीं वि॒ श मु॒ ज्ज य ति॥५॥ त॒ दु त॒ था न॒ कु या त्	/Users/suyash/Desktop/project/experimental_results/binarized/MORPHBG_default/00000019.png	280	526	1893	672
output/crops/page042_line005.png	262534049	42	5	Sanskrit Text	ह्व॒ ल ति वा॒ ऽ ए ष यो॒ य ज्ञ प था दे त्ये॒ ति वा॒ ऽ ए ष॒ य	/Users/suyash/Desktop/project/experimental_results/binarized/MORPHBG_default/00000019.png	279	657	1878	785
output/crops/page042_line006.png	262534049	42	6	Sanskrit Text	ज्ञ प था द्य॒ ए वं॒ क रो॒ ति त॒ स्मा द्य॒ त्रै वे᳘ त रे षां प शू॒	/Users/suyash/Desktop/project/experimental_results/binarized/MORPHBG_default/00000019.png	289	774	1876	908
output/crops/page042_line007.png	262534049	42	7	Sanskrit Text	नां व्व पा॒ भिः प्र च॒ रं ति त॒ दे᳘ वै त॒ स्यै व्व प॒ या प्र॒ च रे	/Users/suyash/Desktop/project/experimental_results/binarized/MORPHBG_default/00000019.png	268	1190	1869	1353
output/crops/page042_line008.png	262534049	42	8	Sanskrit Text	यु रे क᳘ धा व दा॒ ना नि श्र प यं ति न॒ मा नु ष्यै᳘ वि श ऽ	/Users/suyash/Desktop/project/experimental_results/binarized/MORPHBG_default/00000019.png	249	1345	1869	1491
output/crops/page042_line009.png	262534049	42	9	Sanskrit Text	उ॒ प ह र ति॥६॥ अ॒ थ स प्त॒ द श प्रा जा प त्या॒ न्प शू ना॒ ल	/Users/suyash/Desktop/project/experimental_results/binarized/MORPHBG_default/00000019.png	261	1483	1867	1622
output/crops/page042_line010.png	262534049	42	10	Sanskrit Text	भ ते। ते वै स॒ र्वे तू प रा॒ भ वं ति स॒ र्व्वे श्या माः स॒ र्वे मु	/Users/suyash/Desktop/project/experimental_results/binarized/MORPHBG_default/00000019.png	269	1599	1849	1726
output/crops/page042_line011.png	262534049	42	11	Sanskrit Text	ष्क राः॒ प्र जा॒ प तिं वा॒ ऽ ए ष ऽ उ॒ ज्ज य ति यो॒ वा ज पे॒	/Users/suyash/Desktop/project/experimental_results/binarized/MORPHBG_default/00000019.png	244	1729	1814	1847
output/crops/page042_line012.png	262534049	42	12	Sanskrit Text	ये न य॒ ज तें॒ नं वै᳘ प्र जा॒ प तिः प शु र्व्वा ऽ अं॒ नं त॒ त्प्र जा॒	/Users/suyash/Desktop/project/experimental_results/binarized/MORPHBG_default/00000019.png	255	1841	1804	1977
output/crops/page042_line013.png	262534049	42	13	Sanskrit Text	प ति मु॒ ज्ज य ति सो॒ मो वै᳘ प्र जा॒ प तिः प शु र्वै᳘ प्र त्य॒	/Users/suyash/Desktop/project/experimental_results/binarized/MORPHBG_default/00000019.png	255	1962	1837	2089
output/crops/page043_line001.png	262534050	43	1	Sanskrit Text	ये॒ ऽ ए व के॒ च मा रु॒ त्यौ स्या तां। दु र्व्वे॒ दो ऽ ए व॒ व्व शा पृ᳘	/Users/suyash/Desktop/project/experimental_results/binarized/MORPHBG_default/00000018.png	246	150	1819	304
output/crops/page043_line002.png	262534050	43	2	Sanskrit Text	श्नि र्य॒ दि व्व शां पृ᳘ श्निं न॒ विं दे॑ द॒ पि᳘ यै॒ व का॒ च व्व	/Users/suyash/Desktop/project/experimental_results/binarized/MORPHBG_default/00000018.png	258	296	1837	435
output/crops/page043_line003.png	262534050	43	3	Sanskrit Text	शा॒ स्या त्।३। त॒ स्या ऽ आ वृ त्। य॒ त्र हो॒ ता मा हें द्रं	/Users/suyash/Desktop/project/experimental_results/binarized/MORPHBG_default/00000018.png	260	427	1784	560
output/crops/page043_line004.png	262534050	43	4	Sanskrit Text	ग्र॒ ह म नु श᳘ ᳰ स ति त॒ द स्यै व्व प॒ या प्र॒ च रे यु रे	/Users/suyash/Desktop/project/experimental_results/binarized/MORPHBG_default/00000018.png	266	533	1847	680
output/crops/page043_line005.png	262534050	43	5	Sanskrit Text	ष वा ऽ इं॒ द्र स्य नि॒ ष्के व ल्यो ग्र᳘ हो य॒ न्मा हें द्रो॒ प्य	/Users/suyash/Desktop/project/experimental_results/binarized/MORPHBG_default/00000018.png	246	666	1815	807
output/crops/page043_line006.png	262534050	43	6	Sanskrit Text	स्यै त न्नि॒ ष्के व ल्य मे व॒ स्तो त्रं नि॒ ष्के व ल्य ᳰ श स्त्र	/Users/suyash/Desktop/project/experimental_results/binarized/MORPHBG_default/00000018.png	266	790	1819	923
output/crops/page043_line007.png	262534050	43	7	Sanskrit Text	मि॒ न्द्रो वै य॒ ज मा न स्त॒ न्म ध्य त॒ ऽ ए वै त द्य॒ ज मा ने	/Users/suyash/Desktop/project/experimental_results/binarized/MORPHBG_default/00000018.png	299	1233	1804	1398
output/crops/page043_line008.png	262534050	43	8	Sanskrit Text	व्वी र्यं॒ द धा ति त॒ स्मा द स्या ऽ अ॒ त्र व्व प॒ या प्र॒ च रे	/Users/suyash/Desktop/project/experimental_results/binarized/MORPHBG_default/00000018.png	311	1384	1780	1517
output/crops/page043_line009.png	262534050	43	9	Sanskrit Text	युः॥४॥ द्वे धा॒ व दा॒ ना नि श्र प य न्ति। त॒ तो र्द्धा॒ नां	/Users/suyash/Desktop/project/experimental_results/binarized/MORPHBG_default/00000018.png	286	1506	1782	1634
output/crops/page043_line010.png	262534050	43	10	Sanskrit Text	जु ह्वा॒ मु प स्ती॑ र्य द्वि॒ र्द्वि र॒ व द्य ति स कृ द भि॒ घा	/Users/suyash/Desktop/project/experimental_results/binarized/MORPHBG_default/00000018.png	296	1616	1794	1764
output/crops/page043_line011.png	262534050	43	11	Sanskrit Text	र य ति प्र॒ त्य न क्त्य व दा॒ ना न्य॒ थो प भृ ति स कृ	/Users/suyash/Desktop/project/experimental_results/binarized/MORPHBG_default/00000018.png	309	1750	1782	1883
output/crops/page043_line012.png	262534050	43	12	Sanskrit Text	त्स कृ द॒ व द्य ति द्वि॒ र भि॒ घा र य ति न प्र॒ त्य न क्त्य	/Users/suyash/Desktop/project/experimental_results/binarized/MORPHBG_default/00000018.png	311	1861	1833	2020
output/crops/page044_line001.png	262534051	44	1	Sanskrit Text	शा॒ य स्तो त्रा या॒ ल भ ते। त॒ दे त द॒ न ति रा त्रे स ति रा॒	/Users/suyash/Desktop/project/experimental_results/binarized/MORPHBG_default/00000017.png	276	162	1830	308
output/crops/page044_line002.png	262534051	44	2	Sanskrit Text	त्रे रू पं॒ क्रि य ते। प्र जा॒ प तिं वा॒ ऽ ए ष ऽ उ॒ ज्ज य ति	/Users/suyash/Desktop/project/experimental_results/binarized/MORPHBG_default/00000017.png	307	305	1777	440
output/crops/page044_line003.png	262534051	44	3	Sanskrit Text	यो॒ व्वा ज पे॒ ये न य॒ ज ते सं व त्स रो वै॒ प्र जा॒ प ति	/Users/suyash/Desktop/project/experimental_results/binarized/MORPHBG_default/00000017.png	297	439	1799	575
output/crops/page044_line004.png	262534051	44	4	Sanskrit Text	स्त॒ दे ते॒ न सा र स्व ते॒ न रा॒ त्रि मु॒ ज्ज य ति त॒ स्मा	/Users/suyash/Desktop/project/experimental_results/binarized/MORPHBG_default/00000017.png	303	564	1789	705
output/crops/page044_line005.png	262534051	44	5	Sanskrit Text	दे त द॒ न ति रा त्रे स ति रा॒ त्रे रू पं॒ क्रि य ते॥२॥ अ॒ थ	/Users/suyash/Desktop/project/experimental_results/binarized/MORPHBG_default/00000017.png	306	674	1789	818
output/crops/page044_line006.png	262534051	44	6	Sanskrit Text	म रु॒ द्भ्य ऽ उ ज्जे षे॑ भ्यः व शा म्पॄ श्नि मा॒ ल भ त इ	/Users/suyash/Desktop/project/experimental_results/binarized/MORPHBG_default/00000017.png	321	803	1774	953
output/crops/page044_line007.png	262534051	44	7	Sanskrit Text	यं वै॒ व्व शा पृ श्नि र्य॒ दि द॒ म स्यां॒ मू लि॒ चा मू लं॒ चां ना॒	/Users/suyash/Desktop/project/experimental_results/binarized/MORPHBG_default/00000017.png	266	1262	1828	1409
output/crops/page044_line008.png	262534051	44	8	Sanskrit Text	द्यं प्र॒ ति ष्ठि तं ते॒ ने यं॒ व्व शा पृ॒ श्नि रं॒ नं वा॒ ऽ ए ष उ॒	/Users/suyash/Desktop/project/experimental_results/binarized/MORPHBG_default/00000017.png	273	1388	1815	1512
output/crops/page044_line009.png	262534051	44	9	Sanskrit Text	ज्ज य ति यो॒ व्वा ज पे॒ ये न य॒ ज तें न पे॒ य ᳰ ह वै ना॒ मै	/Users/suyash/Desktop/project/experimental_results/binarized/MORPHBG_default/00000017.png	273	1504	1847	1651
output/crops/page044_line010.png	262534051	44	10	Sanskrit Text	त द्य॒ द्वा ज पे॒ यं व्वि॒ शो वै॒ मरु तों॒ नं वै व्वि॒ श ऽ  उ ज्जे	/Users/suyash/Desktop/project/experimental_results/binarized/MORPHBG_default/00000017.png	266	1641	1820	1799
output/crops/page044_line011.png	262534051	44	11	Sanskrit Text	षे॒ भ्य ऽ इ त्यु॒ ज्जि त्या ऽ ए व॒ दु र्वे॒ दे ऽ उ ज्जे ष॒ व त्यौ	/Users/suyash/Desktop/project/experimental_results/binarized/MORPHBG_default/00000017.png	264	1777	1790	1924
output/crops/page044_line012.png	262534051	44	12	Sanskrit Text	या ज्या नु वा क्ये॒ य॒ द्यु ज्जे ष॒ व त्यौ न॒ वि न्दे द॒ पि	/Users/suyash/Desktop/project/experimental_results/binarized/MORPHBG_default/00000017.png	275	1900	1842	2056
output/crops/page045_line001.png	262534052	45	1	Sanskrit Text	व च्च नै॒ नो भ व ति या॒ व त्तृ॒ ण स्या॒ ग्रं तौ उ॒ सा द य तः॥	/Users/suyash/Desktop/project/experimental_results/binarized/MORPHBG_default/00000016.png	238	201	1849	333
output/crops/page045_line002.png	262534052	45	2	Sanskrit Text	१८॥ अ॒ था ध्व र्युः॒ हि र ण्य पा त्रे॒ ण म धु ग्र हं॒ गृ ह्णा	/Users/suyash/Desktop/project/experimental_results/binarized/MORPHBG_default/00000016.png	277	308	1805	427
output/crops/page045_line003.png	262534052	45	3	Sanskrit Text	ति तं म॒ ध्ये सो म ग्र हा॒ णा ᳰ सा द य त्य॒ थो क्थ्यं गृ	/Users/suyash/Desktop/project/experimental_results/binarized/MORPHBG_default/00000016.png	269	421	1879	536
output/crops/page045_line004.png	262534052	45	4	Sanskrit Text	ह्णा त्य॒ थ ध्रु व म॒ थै तां॒ त्सो म ग्र हा॒ नु त्त मे॒ स्तो त्र॒ ऽ	/Users/suyash/Desktop/project/experimental_results/binarized/MORPHBG_default/00000016.png	261	518	1829	657
output/crops/page045_line005.png	262534052	45	5	Sanskrit Text	ऋ त्वि॒ जां च म से॒ षु व्य व नी॒ य जु ह्व ति॑ ता॒ न्भ क्ष यं	/Users/suyash/Desktop/project/experimental_results/binarized/MORPHBG_default/00000016.png	259	637	1849	774
output/crops/page045_line006.png	262534052	45	6	Sanskrit Text	त्य॒ थ मा॒ ध्यं दि ने स॒ व ने म धु ग्र ह॒ स्य च सु रा ग्र हा॒	/Users/suyash/Desktop/project/experimental_results/binarized/MORPHBG_default/00000016.png	207	746	1900	883
output/crops/page045_line007.png	262534052	45	7	Sanskrit Text	णां चो द्य ते त स्या॒ तः॥१९॥ ब्राह्मणं॥२॥ आ ग्ने य॒ म	/Users/suyash/Desktop/project/experimental_results/binarized/MORPHBG_default/00000016.png	257	1268	1796	1413
output/crops/page045_line008.png	262534052	45	8	Sanskrit Text	ग्नि ष्टो मः ऽ आ॒ ल भ ते । अ ग्नि र्व्वा॒ अ ग्नि ष्टो॒ मो ऽ ग्नि ष्टो॑	/Users/suyash/Desktop/project/experimental_results/binarized/MORPHBG_default/00000016.png	295	1397	1798	1549
output/crops/page045_line009.png	262534052	45	9	Sanskrit Text	म॒ मे॒ वै ते नो॒ ज्ज य त्यैं द्रा ग्न॒ मु क्थे॒ भ्य ऽ आ॒ ल भ त ऽ	/Users/suyash/Desktop/project/experimental_results/binarized/MORPHBG_default/00000016.png	291	1540	1804	1669
output/crops/page045_line010.png	262534052	45	10	Sanskrit Text	ऐं द्रा ग्ना॒ नि वा॒ ऽ उ क्था॒ न्यु क्था न्ये॒ वै ते नो॒ ज्ज य त्यैं	/Users/suyash/Desktop/project/experimental_results/binarized/MORPHBG_default/00000016.png	301	1666	1903	1803
output/crops/page045_line011.png	262534052	45	11	Sanskrit Text	द्र॒ ᳰ षो ड शि॒ न ऽ आ॒ ल भ त ऽ इं॒ द्रो वै॒ षो ड शी॒ षो ड	/Users/suyash/Desktop/project/experimental_results/binarized/MORPHBG_default/00000016.png	302	1779	1797	1906
output/crops/page045_line012.png	262534052	45	12	Sanskrit Text	शि॒ न मे॒ वै ते नो॒ ज्ज य ति॥१॥ सा र स्व त॒ ᳰ स प्त द	/Users/suyash/Desktop/project/experimental_results/binarized/MORPHBG_default/00000016.png	302	1880	1828	2014
output/crops/page046_line001.png	262534053	46	1	Sanskrit Text	ण्य भ्य॒ व ह रं ति पु रो क्ष॒ मे व॒ प्र त्यं ङा॒ सी नो ध्व र्युः॒ सो म	/Users/suyash/Desktop/project/experimental_results/binarized/MORPHBG_default/00000015.png	218	164	1807	303
output/crops/page046_line002.png	262534053	46	2	Sanskrit Text	ग्र हा॒ न्गृ ह्णा॒ ति प श्चा द क्षं प्रा ङा॒ सी नो ने॒ ष्टा सु रा ग्र	/Users/suyash/Desktop/project/experimental_results/binarized/MORPHBG_default/00000015.png	219	284	1786	420
output/crops/page046_line003.png	262534053	46	3	Sanskrit Text	हां॒ त्सो म ग्र ह॒ मे॒ वा ध्व र्यु र्गृ ह्णा॒ ति सु रा ग्र हं ने॒ ष्टा सो	/Users/suyash/Desktop/project/experimental_results/binarized/MORPHBG_default/00000015.png	217	418	1813	560
output/crops/page046_line004.png	262534053	46	4	Sanskrit Text	म ग्र ह॒ मे॒ वा ध्व र्यु॒ र्गृ ह्णा॒ ति सु रा ग्र हं ने॒ ष्टै व॒ मे वै ना	/Users/suyash/Desktop/project/experimental_results/binarized/MORPHBG_default/00000015.png	217	543	1826	687
output/crops/page046_line005.png	262534053	46	5	Sanskrit Text	न्व्य त्या॒ सं गृ ह्णी तः॥१६॥ न॒ प्र त्यं॒ च म॒ क्ष म ध्व र्युः॒ सो म	/Users/suyash/Desktop/project/experimental_results/binarized/MORPHBG_default/00000015.png	217	669	1800	806
output/crops/page046_line006.png	262534053	46	6	Sanskrit Text	ग्र ह॒ म ति ह॒ र ति न प्रां॒ च म॒ क्षं ने॒ ष्टा सु रा ग्र हं ने ज्ज्यो॑	/Users/suyash/Desktop/project/experimental_results/binarized/MORPHBG_default/00000015.png	238	790	1820	955
output/crops/page046_line007.png	262534053	46	7	Sanskrit Text	ति श्च त॒ म श्च स ᳰ सृ जा वे॒ ति॥१७॥ उ प॒ र्यु प र्ये वा॒ क्ष	/Users/suyash/Desktop/project/experimental_results/binarized/MORPHBG_default/00000015.png	269	1236	1838	1382
output/crops/page046_line008.png	262534053	46	8	Sanskrit Text	म ध्व र्युः॒ सो म ग्र हं॒ धा र॒ य त्य॒ धो धो॒ क्षं ने॒ ष्टा सु रा ग्र	/Users/suyash/Desktop/project/experimental_results/binarized/MORPHBG_default/00000015.png	274	1376	1851	1490
output/crops/page046_line009.png	262534053	46	9	Sanskrit Text	हं॒ ᳰ सं पृ चौ स्थः सं॒ मा भ द्रे॒ ण पृ ङ्त मि॒ ति ने॒ त्पा प	/Users/suyash/Desktop/project/experimental_results/binarized/MORPHBG_default/00000015.png	264	1507	1794	1637
output/crops/page046_line010.png	262534053	46	10	Sanskrit Text	मि॒ ति ब्र॒ वा वे॒ ति तौ पु॒ न र्वि॒ ह र तो व्वि पृ चौ स्थो वि॒	/Users/suyash/Desktop/project/experimental_results/binarized/MORPHBG_default/00000015.png	266	1629	1877	1771
output/crops/page046_line011.png	262534053	46	11	Sanskrit Text	मा पा प्म॒ ना पृ ङ्त मि॒ ति त द्य॒ थे षी॒ कां मुं जा द्वि वृ हे॒	/Users/suyash/Desktop/project/experimental_results/binarized/MORPHBG_default/00000015.png	282	1757	1803	1893
output/crops/page046_line012.png	262534053	46	12	Sanskrit Text	दे॒ व॒ मे न ᳰ स॒ र्व्व स्मा त्पा प्म॒ नो  व्वि॒ वृ ह त स्त॒ स्मि न्न ता॒	/Users/suyash/Desktop/project/experimental_results/binarized/MORPHBG_default/00000015.png	272	1866	1826	2022
output/crops/page047_line001.png	262534054	47	1	Sanskrit Text	ति मु॒ ज्ज य ति॥१३॥ अ॒ थ य॒ त्र रा॒ जा नं क्री णा॒ ति त॒ द्द	/Users/suyash/Desktop/project/experimental_results/binarized/MORPHBG_default/00000014.png	268	101	1830	259
output/crops/page047_line002.png	262534054	47	2	Sanskrit Text	क्षि ण तः॒ प्र ति वे श तः॒ के श वा त्पु॒ रु षा त्सी॑ से न प	/Users/suyash/Desktop/project/experimental_results/binarized/MORPHBG_default/00000014.png	285	237	1793	361
output/crops/page047_line003.png	262534054	47	3	Sanskrit Text	रि स्रु॒ तं क्री णा ति न वा॒ ऽ ए ष स्त्री न पु॒ मा न्य॒ त्के श वः	/Users/suyash/Desktop/project/experimental_results/binarized/MORPHBG_default/00000014.png	257	358	1819	498
output/crops/page047_line004.png	262534054	47	4	Sanskrit Text	पु॒ रु षो य द॒ ह पु॒ मां स्ते॒ न न स्त्री य॒ दु के श व स्ते॒ नो	/Users/suyash/Desktop/project/experimental_results/binarized/MORPHBG_default/00000014.png	261	509	1780	639
output/crops/page047_line005.png	262534054	47	5	Sanskrit Text	न पु॒ मा न्नै॒ त द॒ यो न हि॒ र ण्यं य त्सी॒ सं॒ नै ष॒ सो॒ मो	/Users/suyash/Desktop/project/experimental_results/binarized/MORPHBG_default/00000014.png	279	623	1759	757
output/crops/page047_line006.png	262534054	47	6	Sanskrit Text	न सु॒ रा य॒ त्प रि स्रु त्त॒ स्मा त्के श वा त्पु॒ रु षा त्सी॑ से न	/Users/suyash/Desktop/project/experimental_results/binarized/MORPHBG_default/00000014.png	263	745	1809	914
output/crops/page047_line007.png	262534054	47	7	Sanskrit Text	प रि स्रु॒ तं क्री णा ति॥१४॥ अ॒ थ पू र्वे द्युः द्वौ ख॒ रौ कु र्वं	/Users/suyash/Desktop/project/experimental_results/binarized/MORPHBG_default/00000014.png	211	1261	1798	1420
output/crops/page047_line008.png	262534054	47	8	Sanskrit Text	ति पु रो क्ष॒ मे॒ वा न्यं॒ प श्चा द क्ष॒ मं न्यं ने॒ त्सो म ग्र हां॒ श्च सु	/Users/suyash/Desktop/project/experimental_results/binarized/MORPHBG_default/00000014.png	220	1414	1811	1542
output/crops/page047_line009.png	262534054	47	9	Sanskrit Text	रा ग्र हां॒ श्च स ह॒ सा द॒ या मे॒ ति त॒ स्मा त्पू र्व्वे द्यु र्द्वौ ख॒	/Users/suyash/Desktop/project/experimental_results/binarized/MORPHBG_default/00000014.png	222	1521	1806	1662
output/crops/page047_line010.png	262534054	47	10	Sanskrit Text	रौ कु र्व्वं ति पु रो क्ष॒ मे॒ वा न्यं॒ प श्चा द क्ष॒ म न्यं ॥१५॥ अ॒ थ य॒	/Users/suyash/Desktop/project/experimental_results/binarized/MORPHBG_default/00000014.png	228	1647	1852	1794
